{
  "schemaVersion": "0.1.0",
  "sessionId": "fixture-warehouse-01",
  "title": "Warehouse warm-up (synthetic)",
  "venue": "synthetic-room",
  "durationSec": 90,
  "streams": [
    { "id": "room-l", "role": "room_mic", "path": "audio/room-l.wav" },
    { "id": "master", "role": "master", "path": "audio/master.wav" },
    { "id": "cam-wide", "role": "camera", "path": "video/wide.mp4" },
    { "id": "mixer", "role": "mixer_midi", "path": "midi/mixer.jsonl" }
  ],
  "privacy": {
    "facesBlurred": true,
    "localOnly": true
  }
}
